1 1 |The Gang Gets Racist| |4 Aug. 2005| 8.301234567891
1 2 |Charlie Wants an Abortion| |11 Aug. 2005| 8.401234567891
1 3 |Underage Drinking: A National Concern| |16 Aug. 2005| 8.501234567891
1 4 |Charlie Has Cancer| |23 Aug. 2005| 8.201234567891
1 5 |Gun Fever| |30 Aug. 2005| 8.101234567891
1 6 |The Gang Finds a Dead Guy| |6 Sep. 2005| 8.201234567891
1 7 |Charlie Got Molested| |13 Sep. 2005| 8.601234567891
2 1 |Charlie Gets Crippled| |29 Jun. 2006| 8.601234567891
2 2 |The Gang Goes Jihad| |29 Jun. 2006| 8.701234567891
2 3 |Dennis and Dee Go on Welfare| |6 Jul. 2006| 9.101234567891
2 4 |Mac Bangs Dennis' Mom| |6 Jul. 2006| 9.201234567891
2 5 |Hundred Dollar Baby| |13 Jul. 2006| 8.801234567891
2 6 |The Gang Gives Back| |20 Jul. 2006| 8.501234567891
2 7 |The Gang Exploits a Miracle| |27 Jul. 2006| 8.101234567891
2 8 |The Gang Runs for Office| |3 Aug. 2006| 8.101234567891
2 9 |Charlie Goes America All Over Everybody's Ass| |10 Aug. 2006| 8.501234567891
2 10 |Dennis and Dee Get a New Dad| |17 Aug. 2006| 8.601234567891
3 1 |The Gang Finds a Dumpster Baby| |13 Sep. 2007| 8.701234567891
3 2 |The Gang Gets Invincible| |13 Sep. 2007| 8.801234567891
3 3 |Dennis and Dee's Mom Is Dead| |20 Sep. 2007| 8.401234567891
3 4 |The Gang Gets Held Hostage| |20 Sep. 2007| 8.901234567891
3 5 |The Aluminum Monster vs. Fatty Magoo| |27 Sep. 2007| 8.101234567891
3 6 |The Gang Solves the North Korea Situation| |27 Sep. 2007| 8.501234567891
3 7 |The Gang Sells Out| |4 Oct. 2007| 8.301234567891
3 8 |Frank Sets Sweet Dee on Fire| |4 Oct. 2007| 8.601234567891
3 9 |Sweet Dee's Dating a Retarded Person| |11 Oct. 2007| 9.301234567891
3 10 |Mac Is a Serial Killer| |18 Oct. 2007| 9.001234567891
3 11 |Dennis Looks Like a Registered Sex Offender| |25 Oct. 2007| 8.501234567891
3 12 |The Gang Gets Whacked: Part 1| |1 Nov. 2007| 8.301234567891
3 13 |The Gang Gets Whacked: Part 2| |1 Nov. 2007| 8.501234567891
3 14 |Bums: Making a Mess All Over the City| |15 Nov. 2007| 8.601234567891
3 15 |The Gang Dances Their Asses Off| |15 Nov. 2007| 9.001234567891
4 1 |Mac and Dennis: Manhunters| |18 Sep. 2008| 8.501234567891
4 2 |The Gang Solves the Gas Crisis| |18 Sep. 2008| 9.101234567891
4 3 |America's Next Top Paddy's Billboard Model Contest| |25 Sep. 2008| 8.501234567891
4 4 |Mac's Banging the Waitress| |25 Sep. 2008| 8.601234567891
4 5 |Mac & Charlie Die: Part 1| |2 Oct. 2008| 9.001234567891
4 6 |Mac & Charlie Die: Part 2| |2 Oct. 2008| 8.701234567891
4 7 |Who Pooped the Bed?| |9 Oct. 2008| 8.401234567891
4 8 |Paddy's Pub: The Worst Bar in Philadelphia| |16 Oct. 2008| 8.501234567891
4 9 |Dennis Reynolds: An Erotic Life| |23 Oct. 2008| 8.301234567891
4 10 |Sweet Dee Has a Heart Attack| |30 Oct. 2008| 8.801234567891
4 11 |The Gang Cracks the Liberty Bell| |6 Nov. 2008| 7.801234567891
4 12 |The Gang Gets Extreme: Home Makeover Edition| |13 Nov. 2008| 8.501234567891
4 13 |The Nightman Cometh| |20 Nov. 2008| 9.701234567891
5 1 |The Gang Exploits the Mortgage Crisis| |17 Sep. 2009| 8.401234567891
5 2 |The Gang Hits the Road| |24 Sep. 2009| 9.101234567891
5 3 |The Great Recession| |1 Oct. 2009| 8.101234567891
5 4 |The Gang Gives Frank an Intervention| |8 Oct. 2009| 8.801234567891
5 5 |The Waitress Is Getting Married| |15 Oct. 2009| 8.801234567891
5 6 |The World Series Defense| |22 Oct. 2009| 8.401234567891
5 7 |The Gang Wrestles for the Troops| |29 Oct. 2009| 8.501234567891
5 8 |Paddy's Pub: Home of the Original Kitten Mittens| |5 Nov. 2009| 9.001234567891
5 9 |Mac and Dennis Break Up| |12 Nov. 2009| 8.601234567891
5 10 |The D.E.N.N.I.S. System| |19 Nov. 2009| 9.301234567891
5 11 |Mac and Charlie Write a Movie| |3 Dec. 2009| 8.201234567891
5 12 |The Gang Reignites the Rivalry| |10 Dec. 2009| 8.601234567891
6 1 |Mac Fights Gay Marriage| |16 Sep. 2010| 8.001234567891
6 2 |Dennis Gets Divorced| |23 Sep. 2010| 7.701234567891
6 3 |The Gang Buys a Boat| |30 Sep. 2010| 8.801234567891
6 4 |Mac's Big Break| |7 Oct. 2010| 8.201234567891
6 5 |Mac and Charlie: White Trash| |14 Oct. 2010| 8.201234567891
6 6 |Mac's Mom Burns Her House Down| |21 Oct. 2010| 7.701234567891
6 7 |Who Got Dee Pregnant?| |28 Oct. 2010| 9.101234567891
6 8 |The Gang Gets a New Member| |4 Nov. 2010| 7.801234567891
6 9 |Dee Reynolds: Shaping America's Youth| |11 Nov. 2010| 8.901234567891
6 10 |Charlie Kelly: King of the Rats| |18 Nov. 2010| 8.401234567891
6 11 |The Gang Gets Stranded in the Woods| |2 Dec. 2010| 8.601234567891
6 12 |Dee Gives Birth| |9 Dec. 2010| 8.501234567891
6 13 |A Very Sunny Christmas| |9 Dec. 2010| 9.201234567891
7 1 |Frank's Pretty Woman| |15 Sep. 2011| 8.601234567891
7 2 |The Gang Goes to the Jersey Shore| |22 Sep. 2011| 9.101234567891
7 3 |Frank Reynolds' Little Beauties| |29 Sep. 2011| 8.501234567891
7 4 |Sweet Dee Gets Audited| |6 Oct. 2011| 8.001234567891
7 5 |Frank's Brother| |13 Oct. 2011| 6.801234567891
7 6 |The Storm of the Century| |20 Oct. 2011| 8.301234567891
7 7 |CharDee MacDennis: The Game of Games| |27 Oct. 2011| 9.201234567891
7 8 |The ANTI-Social Network| |3 Nov. 2011| 8.401234567891
7 9 |The Gang Gets Trapped| |10 Nov. 2011| 8.701234567891
7 10 |How Mac Got Fat| |17 Nov. 2011| 7.801234567891
7 11 |Thunder Gun Express| |1 Dec. 2011| 8.901234567891
7 12 |The High School Reunion| |8 Dec. 2011| 8.301234567891
7 13 |The High School Reunion Part 2: The Gang's Revenge| |15 Dec. 2011| 8.501234567891
8 1 |Pop-Pop: The Final Solution| |11 Oct. 2012| 7.901234567891
8 2 |The Gang Recycles Their Trash| |18 Oct. 2012| 8.301234567891
8 3 |The Maureen Ponderosa Wedding Massacre| |25 Oct. 2012| 8.701234567891
8 4 |Charlie and Dee Find Love| |1 Nov. 2012| 8.901234567891
8 5 |The Gang Gets Analyzed| |8 Nov. 2012| 8.901234567891
8 6 |Charlie's Mom Has Cancer| |15 Nov. 2012| 7.601234567891
8 7 |Frank's Back in Business| |29 Nov. 2012| 8.101234567891
8 8 |Charlie Rules the World| |6 Dec. 2012| 8.401234567891
8 9 |The Gang Dines Out| |13 Dec. 2012| 8.901234567891
8 10 |Reynolds vs. Reynolds: The Cereal Defense| |20 Dec. 2012| 8.901234567891
9 1 |The Gang Broke Dee| |4 Sep. 2013| 8.801234567891
9 2 |Gun Fever Too: Still Hot| |11 Sep. 2013| 8.201234567891
9 3 |The Gang Tries Desperately to Win an Award| |18 Sep. 2013| 9.201234567891
9 4 |Mac and Dennis Buy a Timeshare| |25 Sep. 2013| 8.101234567891
9 5 |Mac Day| |2 Oct. 2013| 8.601234567891
9 6 |The Gang Saves the Day| |9 Oct. 2013| 8.901234567891
9 7 |The Gang Gets Quarantined| |16 Oct. 2013| 8.701234567891
9 8 |Flowers for Charlie| |23 Oct. 2013| 8.801234567891
9 9 |The Gang Makes Lethal Weapon 6| |30 Oct. 2013| 8.101234567891
9 10 |The Gang Squashes Their Beefs| |6 Nov. 2013| 8.301234567891
10 1 |The Gang Beats Boggs| |14 Jan. 2015| 8.701234567891
10 2 |The Gang Group Dates| |21 Jan. 2015| 8.701234567891
10 3 |Psycho Pete Returns| |28 Jan. 2015| 7.601234567891
10 4 |Charlie Work| |4 Feb. 2015| 9.801234567891
10 5 |The Gang Spies Like U.S.| |11 Feb. 2015| 8.301234567891
10 6 |The Gang Misses the Boat| |18 Feb. 2015| 8.801234567891
10 7 |Mac Kills His Dad| |25 Feb. 2015| 8.001234567891
10 8 |The Gang Goes on Family Fight| |4 Mar. 2015| 9.001234567891
10 9 |Frank Retires| |11 Mar. 2015| 8.201234567891
10 10 |Ass Kickers United: Mac and Charlie Join a Cult| |18 Mar. 2015| 7.601234567891
11 1 |Chardee MacDennis 2: Electric Boogaloo| |6 Jan. 2016| 8.601234567891
11 2 |Frank Falls Out the Window| |13 Jan. 2016| 8.001234567891
11 3 |The Gang Hits the Slopes| |20 Jan. 2016| 8.601234567891
11 4 |Dee Made a Smut Film| |27 Jan. 2016| 7.601234567891
11 5 |Mac & Dennis Move to the Suburbs| |3 Feb. 2016| 9.401234567891
11 6 |Being Frank| |10 Feb. 2016| 8.401234567891
11 7 |McPoyle vs. Ponderosa: The Trial of the Century| |17 Feb. 2016| 8.601234567891
11 8 |Charlie Catches a Leprechaun| |24 Feb. 2016| 8.601234567891
11 9 |The Gang Goes to Hell| |2 Mar. 2016| 8.501234567891
11 10 |The Gang Goes to Hell: Part Two| |9 Mar. 2016| 8.401234567891
12 1 |The Gang Turns Black| |4 Jan. 2017| 8.501234567891
12 2 |The Gang Goes to a Water Park| |11 Jan. 2017| 9.501234567891
12 3 |Old Lady House: A Situation Comedy| |18 Jan. 2017| 8.501234567891
12 4 |Wolf Cola: A Public Relations Nightmare| |25 Jan. 2017| 8.201234567891
12 5 |Making Dennis Reynolds a Murderer| |1 Feb. 2017| 8.701234567891
12 6 |Hero or Hate Crime?| |8 Feb. 2017| 9.501234567891
12 7 PTSDee |15 Feb. 2017| 8.701234567891
12 8 |The Gang Tends Bar| |22 Feb. 2017| 8.301234567891
12 9 |A Cricket's Tale| |1 Mar. 2017| 7.401234567891
12 10 |Dennis' Double Life| |8 Mar. 2017| 8.701234567891
13 1 |The Gang Makes Paddy's Great Again| |5 Sep. 2018| 7.801234567891
13 2 |The Gang Escapes| |12 Sep. 2018| 8.201234567891
13 3 |The Gang Beats Boggs: Ladies Reboot| |19 Sep. 2018| 6.801234567891
13 4 |Time's Up for the Gang| |26 Sep. 2018| 9.301234567891
13 5 |The Gang Gets New Wheels| |3 Oct. 2018| 9.101234567891
13 6 |The Gang Solves the Bathroom Problem| |10 Oct. 2018| 8.401234567891
13 7 |The Gang Does a Clip Show| |17 Oct. 2018| 7.501234567891
13 8 |Charlie's Home Alone| |24 Oct. 2018| 6.801234567891
13 9 |The Gang Wins the Big Game| |31 Oct. 2018| 7.001234567891
13 10 |Mac Finds His Pride| |7 Nov. 2018| 8.301234567891
14 1 |The Gang Gets Romantic| |25 Sep. 2019| 8.201234567891
14 2 |Thunder Gun 4: Maximum Cool| |2 Oct. 2019| 8.101234567891
14 3 |Dee Day| |9 Oct. 2019| 8.401234567891
14 4 |The Gang Chokes| |16 Oct. 2019| 8.301234567891
14 5 |The Gang Texts| |23 Oct. 2019| 8.201234567891
14 6 |The Janitor Always Mops Twice| |30 Oct. 2019| 8.601234567891
14 7 |The Gang Solves Global Warming| |6 Nov. 2019| 8.401234567891
14 8 |Paddy's Has a Jumper| |13 Nov. 2019| 8.701234567891
14 9 |A Woman's Right to Chop| |20 Nov. 2019| 8.301234567891
14 10 |Waiting for Big Mo| |20 Nov. 2019| 8.101234567891
